{"schema_version":"l2.v2","scope_id":"repo:clroom","scope_kind":"repo","parent_scope_ids":[],"sections":{"replace":{"test_command":"cargo test"},"deny_union":["no ambient HOME"]},"provenance":[{"source_id":"project","source_kind":"project","source_ref":".clroom/scopes/root.json","sha256":"0000000000000000000000000000000000000000000000000000000000000000"}],"approval":{"status":"approved","receipt_id":"approval-1"},"source_hashes":[{"source_id":"project","sha256":"0000000000000000000000000000000000000000000000000000000000000000"}]}
